{
  "schema_version": "1.0",
  "labels_version": "labels-v1.0",
  "dataset_version": "ds-v0.0-selftest-example",
  "source_kind": "SYNTHETIC",
  "session_id": "synthetic-example",
  "participant_id": "SYNTHETIC",
  "generated_at": "2026-09-22T12:00:00+03:00",
  "provenance": {
    "rules_version": "1.0",
    "rules_hash": "sha256:e3c2498164c63cebe01faac40fd8195ab4fc2bd538b248a2ca6812641469daea",
    "thresholds_hash": "sha256:80a6cb799fa3406bd5841330e99db08adbd9d9bdfd6be3adf8d38a18a71ce917",
    "smoother_id": "rts-kalman-cv-v1",
    "smoother_hash": "sha256:b15f70bcd14d93e754ec5ab50a9e32c0829adddaf88249a2e5a3cf96f89b92b1",
    "tracker_id": "example-tracker:kalman_cv:c_floor0.2-q5.0-r_base0.0001:cv0.60:cm0.30:g3:age0.50:N16",
    "tracker_hash": "sha256:dad65f77008badb7aae30a9fc74b81cf160e1c7be96d9bd1d8382c13205ee17a",
    "geometry_version": "p04-geometry-v1",
    "zone_layout_id": "mvp4",
    "v_min": 0.15,
    "interpolation": "QUADRATIC",
    "config_hash": "sha256:fd7d0926aa672c6815a34b5a67d057b4bb05d4d7a2fe364dbf37be32869dba85",
    "git_sha": "0000000000000000000000000000000000000000",
    "generator": {
      "tool": "spacedrums.data.labels.generate",
      "version": "0.7.0"
    },
    "reference_track_ref": "tracks_reference.jsonl",
    "causal_track_ref": "tracks_causal.jsonl",
    "session_metadata_sha256": "sha256:2f5e72c8c26ab91e9b0d82df82a1c2fb2795f9ba7cc500a550f6ce233ddc469e",
    "labels_hash": "sha256:084a58389df137fa4218d23eb03531528a6dec7d97162691924db69b5c3997e3"
  },
  "inputs": {
    "session_dir": "data/raw/SYNTHETIC/synthetic-example",
    "n_frames": 117,
    "n_segments": 2,
    "n_quarantined_segments": 0,
    "streams": [
      {
        "path": "records/StickObservation.jsonl",
        "sha256": "sha256:47c625f2dae10c2be8e48795ba148271ad7e59c021de63e7bbb20e0905eb5b00",
        "records": 234
      },
      {
        "path": "records/TrackState.jsonl",
        "sha256": "sha256:fda782722bd9db84779f57be459814156250c63579cd4cdd05cbecb470b15415",
        "records": 234
      },
      {
        "path": "records/StrikeCandidate.jsonl",
        "sha256": "sha256:209fe2bbed70c66df8427e69ca65ce837503e0ece18d35730f9c30dd7bd6fc39",
        "records": 9
      },
      {
        "path": "records/CommittedStrike.jsonl",
        "sha256": "sha256:71d193cbf643f921c73c3d540c65bcf00a31f59ee025cc5d615c021c10fb7603",
        "records": 2
      }
    ]
  },
  "counts": {
    "total": 6,
    "by_class": {
      "NEG_FAKE_SWING": 1,
      "NEG_NO_STRIKE_MOTION": 3,
      "POSITIVE": 2
    },
    "by_hand": {
      "LEFT": 3,
      "RIGHT": 3
    },
    "by_zone": {
      "snare": 3
    },
    "by_segment_type": {
      "FAKE_SWING": 3,
      "SINGLE_HITS": 3
    },
    "excluded": 0,
    "ambiguous": 0,
    "label": "MEASURED from this session's labels; evidence class: SYNTHETIC (generated observations; never participant evidence)"
  },
  "files": [
    {
      "path": "labels.jsonl",
      "bytes": 17651,
      "sha256": "sha256:a8301a446d3b7062f277c489a3abc2dd56adeb88d95ae21d7745f084abbf6c37",
      "causal": false
    },
    {
      "path": "tracks_causal.jsonl",
      "bytes": 140408,
      "sha256": "sha256:fda782722bd9db84779f57be459814156250c63579cd4cdd05cbecb470b15415",
      "causal": true
    },
    {
      "path": "tracks_reference.jsonl",
      "bytes": 51911,
      "sha256": "sha256:0ee52074d16d0f1a1738bfe57b25955588ad77fcdb1342794351713ce78fec49",
      "causal": false
    }
  ],
  "qc": {
    "protocol_id": "P07-QC-1",
    "reviewed": 0,
    "accepted": 0,
    "rejected": 0,
    "adjusted": 0,
    "pending": 6,
    "second_pass": 0,
    "sampling": {
      "positives_rate": 0.0,
      "ambiguous_rate": 0.0,
      "negatives_rate": 0.0
    },
    "label": "NOT REVIEWED - generator output only; QC protocol P07-QC-1 not yet applied"
  },
  "phys": {
    "available": false,
    "reason": "no microphone track paired for this session (Task 07.6)",
    "n_pad_positives": 0,
    "n_paired": 0,
    "residual_bias_s": null,
    "residual_iqr_s": null,
    "mic_latency_bound_s": null,
    "label": "PENDING - no acoustic ground truth (ADR-0002 condition not recorded)"
  },
  "notes": "",
  "label": "TEST / DEVELOPMENT ONLY - SYNTHETIC and/or DEV CAPTURE labels; never participant evidence",
  "set_hash": "sha256:2988283b38749c731eab2c40f8eafc4b7add0abddbdf0baffc5d643ed5f9f675"
}
